{
  "schemaVersion": 1,
  "repositoryUrl": "https://github.com/JoshMayerr/btcp-skills",
  "skillSourceUrlTemplate": "https://raw.githubusercontent.com/JoshMayerr/btcp-skills/{name}-v{version}/skills/{name}/SKILL.md",
  "skillArchiveUrlTemplate": "https://github.com/JoshMayerr/btcp-skills/releases/download/{name}-v{version}/{name}.zip"
}
